{
  "name": "BadBandSSH",
  "id": "bssh",
  "version": "0.10.2",
  "author": "Logan Dhillon",
  "homepage": "https://github.com/badtechnologies/bdsh/blob/main/docs/bssh.md",
  "binaries": {
    "bssh": "bssh.py"
  },
  "pythonDependencies": {
    "paramiko": "~5.0.0"
  },
  "setupScripts": [
    "setup.py"
  ],
  "shellVersion": "^0.5.0"
}